{
  "id": "login-form",
  "kind": "content-archetype",
  "version": "1.1.0",
  "description": "Authentication form content built on card, field, input, and button primitives.",
  "layout": "auth-shell",
  "targetRegion": "main",
  "uses": [
    "card",
    "field",
    "input",
    "button"
  ],
  "contentSchema": {
    "title": "string",
    "description": "string",
    "emailLabel": "string",
    "emailHelper": "string",
    "emailPlaceholder": "string",
    "passwordLabel": "string",
    "passwordHelper": "string",
    "passwordPlaceholder": "string",
    "submitLabel": "string"
  },
  "defaults": {
    "title": "Sign in",
    "description": "Use your work email and password to access your workspace.",
    "emailLabel": "Work email",
    "emailHelper": "Use the email tied to your organization.",
    "emailPlaceholder": "name@company.com",
    "passwordLabel": "Password",
    "passwordHelper": "Passwords are case sensitive.",
    "passwordPlaceholder": "Enter your password",
    "submitLabel": "Sign in"
  },
  "regions": {
    "main": [
      {
        "component": "card",
        "props": {
          "title": "{{title}}",
          "description": "{{description}}",
          "tone": "subtle"
        },
        "slots": {
          "body": [
            {
              "component": "field",
              "props": {
                "label": "{{emailLabel}}",
                "helper": "{{emailHelper}}",
                "for": "login-email",
                "required": "true"
              },
              "slots": {
                "control": [
                  {
                    "component": "input",
                    "props": {
                      "id": "login-email",
                      "type": "email",
                      "name": "email",
                      "autocomplete": "email",
                      "placeholder": "{{emailPlaceholder}}"
                    }
                  }
                ]
              }
            },
            {
              "component": "field",
              "props": {
                "label": "{{passwordLabel}}",
                "helper": "{{passwordHelper}}",
                "for": "login-password",
                "required": "true"
              },
              "slots": {
                "control": [
                  {
                    "component": "input",
                    "props": {
                      "id": "login-password",
                      "type": "password",
                      "name": "password",
                      "autocomplete": "current-password",
                      "placeholder": "{{passwordPlaceholder}}"
                    }
                  }
                ]
              }
            }
          ],
          "footer": [
            {
              "component": "button",
              "props": {
                "variant": "primary",
                "text": "{{submitLabel}}"
              }
            }
          ]
        }
      }
    ]
  }
}
